<?xml version="1.0" encoding="UTF-8"?>
<personajes xmlns:xsi="http://www.w3.org/2001/XMLSchema-instance"
	xsi:noNamespaceSchemaLocation="personajes.xsd">

    <personaje>
        <autor>Jose</autor>
        <nombre>Elion</nombre>
        <genero>Masculino</genero>
        <clase>Arquero</clase>
        <apariencia>
            <cabello>#5B3A29</cabello>
            <piel>#F2CDA0</piel>
            <ojos>#1E90FF</ojos>
        </apariencia>
        <habilidades>
            <agilidad>9</agilidad>
            <fuerza>5</fuerza>
            <inteligencia>6</inteligencia>
        </habilidades>
    </personaje>
	
    <personaje>
        <autor>Ángel</autor>
        <nombre>Lyra</nombre>
        <genero>Femenino</genero>
        <clase>Arquero</clase>
        <apariencia>
            <cabello>#FFD700</cabello>
            <piel>#F7E2D0</piel>
            <ojos>#8A2BE2</ojos>
        </apariencia>
        <habilidades>
            <agilidad>10</agilidad>
            <fuerza>4</fuerza>
            <inteligencia>7</inteligencia>
        </habilidades>
    </personaje>

    <personaje>
        <autor>María</autor>
        <nombre>Kael</nombre>
        <genero>Masculino</genero>
        <clase>Guerrero</clase>
        <apariencia>
            <cabello>#222222</cabello>
            <piel>#E0B084</piel>
            <ojos>#228B22</ojos>
        </apariencia>
        <habilidades>
            <agilidad>6</agilidad>
            <fuerza>10</fuerza>
            <inteligencia>5</inteligencia>
        </habilidades>
    </personaje>

    <personaje>
        <autor>Lucía</autor>
        <nombre>Selene</nombre>
        <genero>Femenino</genero>
        <clase>Mago</clase>
        <apariencia>
            <cabello>#8B008B</cabello>
            <piel>#F5E6E8</piel>
            <ojos>#00CED1</ojos>
        </apariencia>
        <habilidades>
            <agilidad>7</agilidad>
            <fuerza>3</fuerza>
            <inteligencia>10</inteligencia>
        </habilidades>
    </personaje>

    <personaje>
        <autor>Carlos</autor>
        <nombre>Drake</nombre>
        <genero>Masculino</genero>
        <clase>Guerrero</clase>
        <apariencia>
            <cabello>#A0522D</cabello>
            <piel>#C68642</piel>
            <ojos>#8B0000</ojos>
        </apariencia>
        <habilidades>
            <agilidad>5</agilidad>
            <fuerza>9</fuerza>
            <inteligencia>4</inteligencia>
        </habilidades>
    </personaje>

    <personaje>
        <autor>Elena</autor>
        <nombre>Mira</nombre>
        <genero>Femenino</genero>
        <clase>Mago</clase>
        <apariencia>
            <cabello>#4169E1</cabello>
            <piel>#F9D5A2</piel>
            <ojos>#483D8B</ojos>
        </apariencia>
        <habilidades>
            <agilidad>8</agilidad>
            <fuerza>2</fuerza>
            <inteligencia>9</inteligencia>
        </habilidades>
    </personaje>

    <personaje>
        <autor>Pedro</autor>
        <nombre>Rurik</nombre>
        <genero>Masculino</genero>
        <clase>Guerrero</clase>
        <apariencia>
            <cabello>#B87333</cabello>
            <piel>#E1C699</piel>
            <ojos>#4682B4</ojos>
        </apariencia>
        <habilidades>
            <agilidad>7</agilidad>
            <fuerza>8</fuerza>
            <inteligencia>5</inteligencia>
        </habilidades>
    </personaje>

    <personaje>
        <autor>Andrea</autor>
        <nombre>Vega</nombre>
        <genero>Femenino</genero>
        <clase>Arquero</clase>
        <apariencia>
            <cabello>#FF69B4</cabello>
            <piel>#FAD6A5</piel>
            <ojos>#00FF7F</ojos>
        </apariencia>
        <habilidades>
            <agilidad>9</agilidad>
            <fuerza>6</fuerza>
            <inteligencia>7</inteligencia>
        </habilidades>
    </personaje>

    <personaje>
        <autor>Jorge</autor>
        <nombre>Thalos</nombre>
        <genero>Masculino</genero>
        <clase>Mago</clase>
        <apariencia>
            <cabello>#2F4F4F</cabello>
            <piel>#EED6C4</piel>
            <ojos>#FFD700</ojos>
        </apariencia>
        <habilidades>
            <agilidad>6</agilidad>
            <fuerza>4</fuerza>
            <inteligencia>9</inteligencia>
        </habilidades>
    </personaje>

    <personaje>
        <autor>Sofía</autor>
        <nombre>Irina</nombre>
        <genero>Femenino</genero>
        <clase>Mago</clase>
        <apariencia>
            <cabello>#9932CC</cabello>
            <piel>#F3E2C7</piel>
            <ojos>#40E0D0</ojos>
        </apariencia>
        <habilidades>
            <agilidad>8</agilidad>
            <fuerza>3</fuerza>
            <inteligencia>10</inteligencia>
        </habilidades>
    </personaje>

    <personaje>
        <autor>Alex</autor>
        <nombre>Nova</nombre>
        <genero>Otro</genero>
        <clase>Mago</clase>
        <apariencia>
            <cabello>#00BFFF</cabello>
            <piel>#E0FFFF</piel>
            <ojos>#FF4500</ojos>
        </apariencia>
        <habilidades>
            <agilidad>7</agilidad>
            <fuerza>5</fuerza>
            <inteligencia>10</inteligencia>
        </habilidades>
    </personaje>

</personajes>